{
  "self": "https://your-domain.atlassian.net/rest/api/2/issue/EX-1/watchers",
  "isWatching": false,
  "watchCount": 1,
  "watchers": [
    {
      "self": "https://your-domain.atlassian.net/rest/api/2/user?accountId=5b10a2844c20165700ede21g",
      "accountId": "5b10a2844c20165700ede21g",
      "displayName": "Mia Krystof",
      "active": false
    }
  ]
}
